{
  "$comment": "GENERATED by contracts/codegen/generate.py from task_station_assignment.schema.yaml - DO NOT EDIT.",
  "$schema": "https://json-schema.org/draft/2020-12/schema",
  "additionalProperties": true,
  "description": "An append-only, time-ranged (site_id, station_id)\u2192task assignment; resolved as-of at ingest \u2014 the dynamic stations.yaml.",
  "properties": {
    "assigned_by": {
      "description": "The supervisor/person who set the assignment (provenance).",
      "type": [
        "string",
        "null"
      ]
    },
    "assignment_id": {
      "description": "The assignment record's own id (the anchor; append-only idempotency, like operational-event.event_id).",
      "minLength": 1,
      "type": "string"
    },
    "created_at": {
      "description": "When this assignment row was appended (distinct from effective_from, which is when it takes effect).",
      "type": [
        "string",
        "null"
      ]
    },
    "effective_from": {
      "description": "Start of this assignment's validity \u2014 HARD (the record's essence; resolution anchor). Diverges from kit/task nullable.",
      "type": "string"
    },
    "effective_to": {
      "description": "End of validity; null = the open/current assignment. A mid-day change closes this and appends a new row.",
      "type": [
        "string",
        "null"
      ]
    },
    "rotation_id": {
      "description": "The assigned rotation/prompt variant (a task carries one-or-more variants selected by rotation_id).",
      "type": [
        "string",
        "null"
      ]
    },
    "schema": {
      "description": "Schema identifier; additive semver (\u00a75).",
      "enum": [
        "eunomia-task-station-assignment/v1"
      ],
      "type": "string"
    },
    "site_id": {
      "description": "Site scope (on the card, provenance.site_id) \u2014 part of the resolution key; a bare station_id collides across sites.",
      "minLength": 1,
      "type": "string"
    },
    "station_id": {
      "description": "The assigned station (on the card, identity.station_id) \u2014 part of the (site_id, station_id, timestamp) resolution key.",
      "minLength": 1,
      "type": "string"
    },
    "task_id": {
      "description": "The assigned task (the catalog entry).",
      "minLength": 1,
      "type": "string"
    },
    "task_version": {
      "description": "The assigned task version (the catalog is versioned; pinned onto the episode at ingest, B/OQ-6).",
      "type": [
        "integer",
        "null"
      ]
    }
  },
  "required": [
    "schema",
    "assignment_id",
    "site_id",
    "station_id",
    "task_id",
    "effective_from"
  ],
  "title": "TaskStationAssignment",
  "type": "object"
}
